{
  "title": "教师003 · 整周课表",
  "timeText": "第1周 · 整周",
  "queryId": "q-schedule-rich-v4",
  "dataVersion": "competition-demo-v1",
  "summary": {"totalCount": 5, "entityType": "teacher", "entityName": "教师003", "scope": "WEEK"},
  "items": [
    {"weekday": 1, "date": "2026-08-31", "periodText": "第5-6节", "courseName": "程序设计基础", "campusName": "校区A", "building": "A2", "roomName": "A2-301", "timeText": "14:00-15:40", "teachers": ["教师003"], "classes": ["2025级A班"]},
    {"weekday": 1, "date": "2026-08-31", "periodText": "第7-8节", "courseName": "计算机组成原理", "campusName": "校区B", "building": "B1", "roomName": "B1-201", "timeText": "16:00-17:40", "teachers": ["教师003"], "classes": ["2025级C班"]},
    {"weekday": 3, "date": "2026-09-02", "periodText": "第1-2节", "courseName": "数据结构", "campusName": "校区A", "building": "A1", "roomName": "A1-201", "timeText": "08:00-09:40", "teachers": ["教师003"], "classes": ["2025级B班"]},
    {"weekday": 4, "date": "2026-09-03", "periodText": "第3-4节", "courseName": "程序设计基础实验", "campusName": "校区A", "building": "A2", "roomName": "A2-302", "timeText": "10:00-11:40", "teachers": ["教师003"], "classes": ["2025级A班"]},
    {"weekday": 5, "date": "2026-09-04", "periodText": "第5-6节", "courseName": "数据结构", "campusName": "校区B", "building": "B1", "roomName": "B1-202", "timeText": "14:00-15:40", "teachers": ["教师003"], "classes": ["2025级B班"]}
  ],
  "actions": [
    {"id": "schedule-choose-day", "type": "sys.chat", "label": "选择日期", "query": "【小序操作:选择课表日期】教师003|第1周", "intent": "schedule_choose_day", "entityType": "teacher", "entityName": "教师003", "week": 1, "weekday": null, "date": ""},
    {"id": "schedule-week-risk", "type": "sys.chat", "label": "本周风险", "query": "检查教师003第1周是否存在时间冲突或跨校区赶场", "intent": "schedule_risk_check", "entityType": "teacher", "entityName": "教师003", "week": 1, "weekday": null, "date": ""},
    {"id": "schedule-recent-day", "type": "sys.chat", "label": "返回最近一天", "query": "查询教师003第1周周一的课", "intent": "schedule_day", "entityType": "teacher", "entityName": "教师003", "week": 1, "weekday": 1, "date": "2026-08-31"}
  ]
}
